{
  "$schema": "https://json-schema.org/draft/2020-12/schema",
  "$id": "https://mr-friess-classroom-engine/schemas/lesson-package.schema.json",
  "title": "Stable Core Lesson Package Schema",
  "type": "object",
  "required": [
    "schema_version",
    "package_id",
    "primary_architecture"
  ],
  "properties": {
    "schema_version": {
      "type": "string",
      "pattern": "^2\\.1"
    },
    "package_id": {
      "type": "string",
      "minLength": 1
    },
    "primary_architecture": {
      "type": "string",
      "enum": [
        "single_period_full",
        "multi_day_sequence"
      ]
    },
    "secondary_architecture_support": {
      "oneOf": [
        {
          "type": "string",
          "minLength": 1
        },
        {
          "type": "object",
          "required": [
            "note"
          ],
          "properties": {
            "architecture": { "type": "string" },
            "note": { "type": "string", "minLength": 1 }
          },
          "additionalProperties": true
        }
      ]
    },
    "materials_control_note": {
      "type": "string"
    },
    "materials_control_note_required": {
      "type": "boolean"
    },
    "bundle": {
      "type": "object",
      "required": ["bundle_id", "declared_outputs"],
      "properties": {
        "bundle_id": { "type": "string" },
        "declared_outputs": {
          "type": "array",
          "items": {
            "$ref": "#/$defs/outputType"
          }
        }
      },
      "additionalProperties": true
    },
    "outputs": {
      "type": "array",
      "items": { "$ref": "#/$defs/output" }
    },
    "slides": {
      "type": "array",
      "items": { "$ref": "#/$defs/slideNode" }
    },
    "worksheet": {
      "$ref": "#/$defs/worksheetSection"
    },
    "days": {
      "type": "array",
      "items": { "$ref": "#/$defs/day" }
    }
  },
  "allOf": [
    {
      "if": {
        "properties": {
          "primary_architecture": { "const": "multi_day_sequence" }
        }
      },
      "then": {
        "required": ["days"]
      }
    }
  ],
  "$defs": {
    "audience": {
      "type": "string",
      "enum": ["teacher", "student", "shared_view"]
    },
    "outputType": {
      "type": "string",
      "enum": [
        "teacher_guide",
        "lesson_overview",
        "slides",
        "worksheet",
        "task_sheet",
        "checkpoint_sheet",
        "exit_ticket",
        "final_response_sheet"
      ]
    },
    "imageRole": {
      "type": "string",
      "enum": [
        "cue_icon",
        "small_illustration",
        "reference_photo",
        "example_visual",
        "instructional_diagram"
      ]
    },
    "imagePurpose": {
      "type": "string",
      "enum": [
        "orient_lesson",
        "explain_content",
        "organize_attention"
      ]
    },
    "imageIntent": {
      "type": "object",
      "properties": {
        "role": { "$ref": "#/$defs/imageRole" },
        "purpose": { "$ref": "#/$defs/imagePurpose" },
        "required": { "type": "boolean" },
        "disallow_images": { "type": "boolean" },
        "preferred_asset_tags": {
          "type": "array",
          "items": { "type": "string" }
        }
      },
      "additionalProperties": true
    },
    "worksheetResponseMode": {
      "type": "string",
      "enum": [
        "generic",
        "two_choice_explanations",
        "two_reasons",
        "example_explanation",
        "judgment_reasoning"
      ]
    },
    "worksheetQuestion": {
      "type": "object",
      "properties": {
        "q_num": {
          "oneOf": [
            { "type": "integer" },
            { "type": "string", "minLength": 1 }
          ]
        },
        "q_text": { "type": "string" },
        "n_lines": { "type": "integer", "minimum": 1 },
        "response_mode": { "$ref": "#/$defs/worksheetResponseMode" },
        "response_labels": {
          "type": "array",
          "items": { "type": "string", "minLength": 1 }
        }
      },
      "additionalProperties": true
    },
    "worksheetSection": {
      "type": "object",
      "properties": {
        "title": { "type": "string" },
        "anchor": {
          "type": "array",
          "items": { "type": "string" }
        },
        "tip": { "type": "string" },
        "questions": {
          "type": "array",
          "items": { "$ref": "#/$defs/worksheetQuestion" }
        },
        "self_check": {
          "type": "array",
          "items": { "type": "string" }
        },
        "answer_key": {
          "type": "array",
          "items": { "type": "string" }
        }
      },
      "additionalProperties": true
    },
    "slideNode": {
      "type": "object",
      "properties": {
        "type": { "type": "string" },
        "title": { "type": "string" },
        "layout": { "type": "string" },
        "content": { "type": "object" },
        "image_intent": { "$ref": "#/$defs/imageIntent" }
      },
      "additionalProperties": true
    },
    "output": {
      "type": "object",
      "required": ["output_id", "output_type", "audience"],
      "properties": {
        "output_id": { "type": "string" },
        "output_type": { "$ref": "#/$defs/outputType" },
        "audience": { "$ref": "#/$defs/audience" },
        "source_section": { "type": "string" },
        "bundle": { "type": "string" },
        "is_embedded": { "type": "boolean" },
        "final_evidence": { "type": "boolean" },
        "image_intent": { "$ref": "#/$defs/imageIntent" },
        "embedded_support_elements": {
          "type": "array",
          "items": { "type": "object" }
        }
      },
      "additionalProperties": true
    },
    "day": {
      "type": "object",
      "required": ["day_id", "day_label", "outputs"],
      "properties": {
        "day_id": { "type": "string" },
        "day_label": { "type": "string" },
        "carryover_note": { "type": "string" },
        "slides": {
          "type": "array",
          "items": { "$ref": "#/$defs/slideNode" }
        },
        "worksheet": {
          "$ref": "#/$defs/worksheetSection"
        },
        "outputs": {
          "type": "array",
          "items": { "$ref": "#/$defs/output" }
        }
      },
      "additionalProperties": true
    }
  },
  "additionalProperties": true
}
