{
  "schema_version": "2.1.0",
  "package_id": "benchmark1_single_period_full",
  "primary_architecture": "single_period_full",
  "bundle": {
    "bundle_id": "benchmark1_bundle",
    "declared_outputs": [
      "teacher_guide",
      "slides",
      "worksheet",
      "exit_ticket"
    ]
  },
  "outputs": [
    {
      "output_id": "teacher_guide_main",
      "output_type": "teacher_guide",
      "audience": "teacher",
      "source_section": "teacher_guide",
      "bundle": "benchmark1_bundle"
    },
    {
      "output_id": "slides_main",
      "output_type": "slides",
      "audience": "shared_view",
      "source_section": "slides",
      "bundle": "benchmark1_bundle"
    },
    {
      "output_id": "worksheet_main",
      "output_type": "worksheet",
      "audience": "student",
      "source_section": "worksheet",
      "bundle": "benchmark1_bundle"
    },
    {
      "output_id": "exit_ticket_main",
      "output_type": "exit_ticket",
      "audience": "student",
      "source_section": "exit_ticket",
      "bundle": "benchmark1_bundle",
      "final_evidence": true
    }
  ]
}
